{
  "口径说明": [
    "目标：以 2026 H1（2026-05H1参考）为冻结对照基准，复核观察期间内整体技术人力成本与折算人头的水平与变化幅度（合成数据演示）。；说明营收业务（含共享平台）口径的成本、折算人头与收入的匹配情况。；给出整体、营收业务与全口径三个成本率的水平，并解释差异来源。；列明缺少同口径数据的期次与领域，说明缺口对上述结论的影响。。",
    "期间：2026-01 与 2026-09 为已发生实际期次；2026-05 为 H1 参考期次；年末测算与年末目标为测算或目标值。",
    "单位：技术人力成本为万元/月（不含运维与设施）；折算人头为当量折算值，非自然人数；收入为万美元/月；成本率为成本占同期收入按汇率折人民币的比例。",
    "汇率：7.2 人民币/美元；数据截止：2026-09-30。",
    "null 含义：表示该期次未统计、未提供或无同口径对比数据，界面显示为未提供，不以 0 或其他推测值替代。",
    "整体技术人力成本 缺 2026-05 数据，按 null 处理",
    "营收业务技术人力成本 缺 2026-05 数据，按 null 处理",
    "运维设施成本 缺 2026-05 数据，按 null 处理",
    "整体折算人头 缺 2026-05 数据，按 null 处理",
    "营收业务折算人头 缺 2026-05 数据，按 null 处理"
  ],
  "scope": {
    "数据截止": "2026-09-30",
    "观察月份": "2026-09",
    "来源": "合成示例数据",
    "schema版本": 4
  },
  "conclusion": "2026-01 至 2026-09，整体技术人力成本由 10.4 万元/月变为 12.4 万元/月，整体技术人力成本率由约12.9%变为约12.7%，收入由 11.2 万美元/月变为 13.6 万美元/月；参考期次与年末测算的缺口见 risks。",
  "origin": "DA 快照（合成示例原始数据，按任务书口径计算）",
  "metrics": [
    {
      "标题": "整体技术人力成本",
      "数值": {
        "2026-01实际": 10.4,
        "2026-05H1参考": null,
        "2026-09实际": 12.4,
        "年末测算": 13.4
      }
    },
    {
      "标题": "整体折算人头",
      "数值": {
        "2026-01实际": 10.4,
        "2026-05H1参考": null,
        "2026-09实际": 12.4,
        "年末测算": 13.4
      }
    },
    {
      "标题": "营收业务（含共享平台）技术人力成本与折算人头",
      "数值": {
        "成本": {
          "2026-01实际": 8.3,
          "2026-05H1参考": null,
          "2026-09实际": 9.9,
          "年末测算": 10.7
        },
        "折算人头": {
          "2026-01实际": 8.3,
          "2026-05H1参考": null,
          "2026-09实际": 9.9,
          "年末测算": 10.7
        }
      }
    },
    {
      "标题": "收入与成本率",
      "数值": {
        "收入万美元每月": {
          "2026-01实际": 11.2,
          "2026-05H1参考": 12.4,
          "2026-09实际": 13.6,
          "年末测算": 14.8,
          "年末目标": 15.2
        },
        "整体技术人力成本率": {
          "2026-01实际": "约12.9%",
          "2026-05H1参考": null,
          "2026-09实际": "约12.7%",
          "年末测算": "约12.6%"
        },
        "营收业务技术人力成本率": {
          "2026-01实际": "约10.3%",
          "2026-05H1参考": null,
          "2026-09实际": "约10.1%",
          "年末测算": "约10.0%"
        },
        "全口径技术成本率含运维设施": {
          "整体2026-01实际": "约15.5%",
          "整体2026-05H1参考": null,
          "整体2026-09实际": "约15.2%",
          "整体年末测算": null
        }
      }
    }
  ],
  "insights": [
    {
      "类型": "事实",
      "标题": "整体技术人力成本 2026-01 → 2026-09",
      "内容": "整体技术人力成本由 10.4 万元/月（2026-01）变为 12.4 万元/月（2026-09）；年末测算 13.4 万元/月（测算值，非已发生实际）。"
    },
    {
      "类型": "事实",
      "标题": "整体折算人头 2026-01 → 2026-09",
      "内容": "整体折算人头由 10.4（2026-01）变为 12.4（2026-09）；年末测算 13.4（当量折算，非自然人数）。"
    },
    {
      "类型": "事实",
      "标题": "整体技术人力成本率 约12.9% → 约12.7%",
      "内容": "整体技术人力成本率由约12.9%变为约12.7%；同期收入由 11.2 万美元/月变为 13.6 万美元/月，按汇率 7.2 折人民币计算。"
    },
    {
      "类型": "事实",
      "标题": "营收业务成本与折算人头 2026-01 → 2026-09",
      "内容": "营收业务（含共享平台）技术人力成本由 8.3 万元/月变为 9.9 万元/月；折算人头由 8.3 变为 9.9；营收业务技术人力成本率约10.3% → 约10.1%。"
    },
    {
      "类型": "推断",
      "标题": "成本增速不高于收入增速",
      "内容": "整体技术人力成本增幅 19.2%，收入增幅 21.4%，成本率未出现上行压力；该推断基于任务书口径，需真实台账复核。"
    },
    {
      "类型": "推断",
      "标题": "营收业务成本占比 79.8% → 79.8%",
      "内容": "营收业务成本占整体技术人力成本的 79.8% → 79.8%，未见明显结构迁移；该推断基于任务书口径，需真实台账复核。"
    },
    {
      "类型": "边界",
      "标题": "参考期次 2026-05 缺同口径数据",
      "内容": "参考期次 2026-05 缺少同口径的整体技术人力成本、营收业务技术人力成本、运维设施成本、整体折算人头、营收业务折算人头，快照按口径约定记为 null（2026-05H1参考），未用其他期次或估算值替代。"
    },
    {
      "类型": "边界",
      "标题": "年末为测算与目标值",
      "内容": "年末测算与年末目标是前瞻预算与目标估算，不代表已发生实际；与实际期次比较时须注明口径差异。"
    },
    {
      "类型": "边界",
      "标题": "合成样本边界",
      "内容": "本快照由 da/sample-raw 下的合成原始数据生成，只用于流程演示，不能用于判断任何真实组织。"
    },
    {
      "类型": "事实",
      "标题": "观察期间内整体技术人力成本是多少？相对期初实际增减多少（金额与百分比）？",
      "内容": "整体技术人力成本 10.4 → 12.4 万元/月；营收业务技术人力成本 8.3 → 9.9 万元/月。"
    },
    {
      "类型": "事实",
      "标题": "整体折算人头的变化与整体技术人力成本的变化是否同向？折算人头口径是否与成本口径一致？",
      "内容": "整体折算人头 10.4 → 12.4；营收业务折算人头 8.3 → 9.9。"
    },
    {
      "类型": "事实",
      "标题": "营收业务（含共享平台）的技术人力成本与折算人头分别是多少？占整体口径的比例是多少？",
      "内容": "整体折算人头 10.4 → 12.4；营收业务折算人头 8.3 → 9.9。"
    },
    {
      "类型": "事实",
      "标题": "观察期间的收入是多少（万美元/月）？整体技术人力成本率与营收业务技术人力成本率各是多少？",
      "内容": "整体技术人力成本率 约12.9% → 约12.7%；营收业务技术人力成本率 约10.3% → 约10.1%；全口径技术成本率（含运维设施）约15.5% → 约15.2%。"
    },
    {
      "类型": "事实",
      "标题": "全口径技术成本率（含运维与设施）在哪些期次有同口径值？缺同口径值的期次如何呈现？",
      "内容": "整体技术人力成本率 约12.9% → 约12.7%；营收业务技术人力成本率 约10.3% → 约10.1%；全口径技术成本率（含运维设施）约15.5% → 约15.2%。"
    },
    {
      "类型": "边界",
      "标题": "哪些结论只能由聚合口径支撑，哪些领域因缺少证据而无法回答？",
      "内容": "任务书问题在本次原始数据中没有对应口径，已列为缺失证据；补齐数据需求后再回答。"
    }
  ],
  "definitions": [
    "期间：2026-01 与 2026-09 为已发生实际期次；2026-05 为 H1 参考期次；年末测算与年末目标为测算或目标值。",
    "数据截止：2026-09-30；观察月份：2026-09；收入折人民币按汇率 7.2 计算。",
    "null 含义：表示该期次未统计、未提供或无同口径对比数据，界面显示为未提供，不以 0 或其他推测值替代。",
    "任务书禁止事项：不得写入真实组织数据：任务书只写口径、问题与字段映射，真实数字与明细只留在仓库外的工作目录。；不作个人/薪酬/编制判断：只输出聚合口径，不含个人级字段、薪酬明细与编制明细。；不得编造数字：没有取数支撑的值一律写 null，并在 risks/recommendations 的“缺失证据”里写明缺口。；不得改动指标标题与顺序：metrics 的四个标题与顺序与站点期望一致，改动会被页面判为结构错误。；不得把推断写成事实：洞察按“事实/推断/边界”标注，推断必须写明依据与核实方式。；不得把仓库外的真实数据复制进仓库：诊断 JSON 写在仓库外，交接只给路径与校验值。。"
  ],
  "risks": [
    {
      "标题": "参考期次 2026-05 数据缺口",
      "内容": "参考期次 2026-05 缺少同口径的整体技术人力成本、营收业务技术人力成本、运维设施成本、整体折算人头、营收业务折算人头，快照以 null 表示；页面显示为未提供，不以其他期次或估算值替代。"
    },
    {
      "标题": "全口径年末测算缺口",
      "内容": "年末测算缺少运维设施成本口径，全口径技术成本率年末测算为 null；年末实际值须在年末后按实际台账重算。"
    },
    {
      "标题": "年末测算与年末目标并存",
      "内容": "收入同时给出年末测算 14.8 万美元/月与年末目标 15.2 万美元/月，两者口径不同，页面分别展示，不做相互替代。"
    },
    {
      "标题": "观察期间覆盖不完整",
      "内容": "原始数据在 2026-01 至 2026-09 期间覆盖 9 个月份（2026-01、2026-02、2026-03、2026-04、2026-05、2026-06、2026-07、2026-08、2026-09），但各表覆盖不一致（成本缺 2026-05；折算人头缺 2026-05；收入无缺口），成本变化可能受未覆盖月份影响。"
    },
    {
      "标题": "合成数据边界",
      "内容": "原始数据为人工构造的合成样本，不含任何真实组织信息，也不构成人员、薪酬或编制结论。"
    }
  ],
  "recommendations": [
    {
      "优先级": "P1",
      "标题": "补齐参考期次 2026-05 的同口径取数",
      "依据": "参考期次 2026-05 缺少整体技术人力成本、营收业务技术人力成本、运维设施成本、整体折算人头、营收业务折算人头，快照只能以 null 表示，无法给出同口径对照。",
      "缺失证据": "2026-05 的整体技术人力成本、折算人头与营收业务技术人力成本明细。",
      "验证方式": "与财务台账核对 2026-05 的整体技术人力成本与折算人头，回填原始数据后重跑 build_diagnosis.py。"
    },
    {
      "优先级": "P2",
      "标题": "补齐年末运维设施成本口径",
      "依据": "年末测算缺运维设施成本，导致全口径技术成本率年末测算为 null。",
      "缺失证据": "年末运维与设施成本的预算或测算口径说明。",
      "验证方式": "与运维负责人确认年末运维设施成本口径后回填 forecast.csv 并重算。"
    },
    {
      "优先级": "P2",
      "标题": "核对年末测算与年末目标的口径差异",
      "依据": "收入同时给出年末测算 14.8 与年末目标 15.2 万美元/月，口径不同却同屏展示。",
      "缺失证据": "目标制定依据、测算假设与两者的换算说明。",
      "验证方式": "与业务负责人核对目标口径与测算假设，并在方法说明中记录差异。"
    },
    {
      "优先级": "P2",
      "标题": "补齐逐月原始数据并复核覆盖月份",
      "依据": "观察期间内各表覆盖不一致（成本缺 2026-05；折算人头缺 2026-05；收入无缺口），成本变化可能受未覆盖月份影响。",
      "缺失证据": "观察期间逐月的技术人力成本、折算人头与收入明细。",
      "验证方式": "补齐逐月数据后重跑 build_diagnosis.py，并逐月与台账核对差异。"
    }
  ]
}
